,score,description,date
2254,2,Mouse super leve e com clique rápido. O que eu precisava por trabalhar com design,30 de junho de 2021
2255,2,Ótimo para trabalhar,10 de julho de 2021
2256,2,Produto e bem legal leve e prático,17 de dezembro de 2021
2257,2,"Possuo um já faz mais de 2 anos e agora comprei mais 2, me atende muito bem para trabalho e lazer.",13 de março de 2020
2258,2,"A mídia não pôde ser carregada.
                




   Ótimo produto, bem embalado, muito preciso. Pode comprar sem medo.",3 de janeiro de 2021
2259,2,Já troquei pilha umas 2x pilhas novas.,11 de março de 2020
2260,2,Muito bom!,23 de outubro de 2020
2261,2,"Bonito, ergonômico e de excelência qualidade e precisão.",13 de maio de 2021
2262,1,"Por vezes, deixa de responder, tem um delay muito grande",13 de outubro de 2021
2263,2,"É leve e suave para se utilizar, funciona sem problemas.",8 de julho de 2020
2264,2,"Muito ágil, simples de conectar e até o momento não houve nenhum contra.",12 de julho de 2020
2265,2,Gostei muito do produto e chegou até antes do prazo previsto de entrega.,17 de março de 2022
2266,2,O outro mouse da Multilaser eu não gostei pois quebrou em 30 dias de uso,11 de março de 2022
2267,2,Gostei do mouse!talvez um dos melhores importante destacar que ele já vem com bateria inclusa.,5 de setembro de 2020
2268,2,Ótimo mouse bluetooth pelo preço bem em conta que estava quando comprei.,27 de julho de 2021
2269,2,Atende bem a necessidade de uso básico do mouse.,20 de março de 2021
2270,2,"Ótimo mouse e entrega super rápida, como sempre.",12 de maio de 2020
2271,2,O mouse atendeu perfeitamente minha expectativa.,2 de outubro de 2020
2272,2,Excelente custo benefício. Ergonômico e preciso. Atendeu às minhas expectativas.,18 de fevereiro de 2021
2273,2,Produto ótimo,11 de janeiro de 2022
2274,2,Basicamente cumpre o que promete.,5 de outubro de 2020
2275,2,"leve, confortavel, bom para jogos",7 de outubro de 2021
2276,2,"melhor mouse que já tive, mas uso para coisas do dia a dia. confortável e preciso.",22 de outubro de 2020
2277,2,"Mouse muito bom, preciso, atendeu minha expectativa, custo beneficio ótimo, recomendo.",18 de julho de 2020
2278,2,"O peso dele é bom, não tive nenhum problema com a precisão até agora e é muito bonito.",19 de julho de 2020
2279,2,"O mouse é muito bom, tem um preço super justo, tamanho ótimo, além de ser lindo.",6 de julho de 2021
2280,2,Muito bom. Contem o que é preciso para um mouse de qualidade.,8 de junho de 2020
2281,2,Me surpreendi. Alta qualidade!,7 de maio de 2020
2282,2,"Muito prático e confortável, excelente!!",10 de setembro de 2020
2283,2,"A mídia não pôde ser carregada.
                




   Produto excelente chegou dentro do prazo",9 de setembro de 2021
2284,2,"Para trabalhar e estudar é muito bom, para jogos eu não posso dizer pois não joguei com ele.",15 de novembro de 2020
2285,2,"Excelente custo benefício! Anatômico , leve e responde super bem aos comandos . Recomendo .",2 de junho de 2020
2286,2,"Ótimo produto, e com preço justo.",11 de abril de 2020
2287,2,Produto de qualidade funciona muito bem.,14 de dezembro de 2021
2288,2,"entrega veio com bastante atraso. mouse de qualidade, bonito e muito funcional.",20 de agosto de 2020
2289,2,"Design moderno, funciona bem em qualquer superfície e vendido por um bom preço.",4 de janeiro de 2021
2290,2,"Adorei o produto, muito leve e prático.Comprei na cor prata, muito lindo.",31 de março de 2020
2291,2,"Muito leve e sensível, ideia para o dia a dia, além de muito bonito. Recomendo!",6 de junho de 2021
2292,2,Produto de excelente qualidade e a entrega foi feita antes do prazo. Muito bom!,10 de setembro de 2020
2293,2,"Atende as necessidades, funciona perfeitamente.",26 de julho de 2021
2294,2,"Ele é um pouco menor do que imaginei, não tem uma ergonomia tão boa porém é muito preciso para trabalhar.",12 de março de 2020
2295,2,Bom tamanho e usabilidade,27 de julho de 2021
2296,2,"muito bom ,inclusive estou usando agora mesmo .",14 de dezembro de 2021
2297,2,Um dos melhores produtos em questões de durabilidade e custo/beneficio.,12 de junho de 2021
2298,2,Se adapta a mao,3 de julho de 2020
2299,2,"Produto incrível, estou usando a um mês e funciona perfeitamente. Atendeu todas as minhas expectativas!!",19 de março de 2021
2300,2,"Produto de excelente qualidade, prático, preciso e ergonômico.",1 de setembro de 2021
2301,2,Produto confortável com um bom custo benefício.,27 de junho de 2020
2302,2,Atende perfeitamente a todo tipo de uso no computador/notebook.,15 de outubro de 2020
2303,2,Excelente! Melhor que outras marcas.,29 de novembro de 2020
2304,2,"Pequeno, bonito e funciona super bem. Faz um pouco de barulho.",10 de dezembro de 2021
2305,2,"Mouse bem leve e funciona muito, recomendo muito este produto.",18 de dezembro de 2021
2306,2,"Chegou bem rápido e é super fácil de começar a usar, já veio até com uma pilha",22 de fevereiro de 2021
2307,2,"Excelente custo benefício, boa qualidade, atende para o trabalho do dia a dia.",16 de maio de 2021
2308,2,Gostei. Possui manuseio confortável e leve,7 de junho de 2020
2309,2,Um excelente mouse. Gostei muito da ergonomia!,5 de setembro de 2020
2310,2,Foi uma compra para a empresa.... avaliação somente após o uso....,19 de abril de 2020
2311,2,Um dos melhores da marca,21 de agosto de 2020
2312,2,Gostei e comprarei outro,20 de fevereiro de 2022
2313,2,Ótimo mouse no custo-benefício.,11 de julho de 2021
2314,2,Atende bem minhas necessidades.,31 de julho de 2021
2315,2,"Muito bom!! Preciso e resistente, já derrubei varias coisas e nunca quebrou rs",15 de setembro de 2021
2316,2,"Ele tem resposta rápida, não tem luzes, o que pra mim é uma vantagem, é confortável de usar e muito bonito :)",6 de outubro de 2020
2317,2,"Um mouse muito bom, atende bem ao uso diário, único problema dele é o tamanho que é um tanto quanto pequeno. Mas me serve muito bem e vale o preço.",9 de setembro de 2020
2318,2,"Temia que poderia ser pequeno demais, mas para mim ficou ótimo. Confortável e preciso o suficiente para uso do dia a dia.",2 de janeiro de 2020
2319,2,"Bom produto, leve e de boa utilização.",10 de maio de 2021
2320,2,"Mouse muito bom, tamanho pequeno, recomendo pra quem tem mãos mais pequenas, mouse de muita boa precisão",26 de julho de 2021
2321,2,"Acabamento muito bom e funcionamento suave com o melhor preço para o mouse (o de cor preta que escolhi, era o mais barato). Surpresa muito boa!",4 de abril de 2019
2322,2,"Excelente, cumpre o que promete.",26 de junho de 2020
2323,0,Produto chegou com defeito. Não funciona!!’Já coloquei pilhas novas e nadaExperiência ruim de compra,13 de outubro de 2020
2324,0,Enviou outra cor. Comprei um mouse vermelho e chegou prata. Chateada,8 de julho de 2020
2325,2,"Leve com ótima ergonomia, plugou conectou. Excelente produto.",16 de fevereiro de 2022
2326,2,Produto de qualidade.  Atende perfeitamente  para uso diário.,4 de abril de 2021
2327,2,"Gostei muito do mouse, ele é bem preciso, tem um design bonito e o preço é bem justo.",3 de julho de 2020
2328,2,Mouse sem fio é muito bom e a qualidade desse é ótima,14 de maio de 2021
2329,2,Ótimo custo benefício para quem procura um mouse simples e confiável.,1 de julho de 2021
2330,2,Produto muito bom e chegou direitinho antes do prazo.,14 de setembro de 2021
2331,2,"Muito bom, leve e para quem tem a mão pequena fica muito confortável.",9 de abril de 2021
2332,2,"Produto excelente, e chegou antes da data prevista. Super satisfeito.",9 de abril de 2020
2333,2,"Atendeu minhas necessidades perfeitamente, excelente custo benefício.",24 de outubro de 2020
2334,2,"Produto chegou antes do previsto e em perfeito estado, indico muito!!",26 de maio de 2021
2335,2,Entrega rápida. Produto me satisfez completamente. Recomendo.,4 de dezembro de 2021
2336,2,"Anatômico, preciso, longa duração da bateria.",30 de agosto de 2021
2337,2,Melhor mouse com custo benefício. Só é mais leve do que eu imaginava. Mas é ideal para usar no trabalho ou em casa.,12 de janeiro de 2020
2338,2,Queria um mouse barato apenas para trabalho e esse serviu muito bem.,22 de julho de 2020
2339,2,"Bom mouse, atende para tarefas diarias, não é muito pequeno e tem boa conexão",17 de março de 2022
2340,2,É um produto muito bom.,10 de maio de 2021
2341,2,Atendeu às minhas expectativas,6 de outubro de 2020
2342,2,Bom produto de custo benefício,27 de junho de 2021
2343,2,execelente,23 de julho de 2021
2344,2,Muito bom e pratico,17 de janeiro de 2020
2345,2,Prático e rápido,28 de fevereiro de 2021
2346,2,"Muito bom o mouse, pequeno e preciso e feito com excelente material.",24 de setembro de 2020
2347,2,super facil de instalar e bastante preciso .Ótimocusto x beneficio !,24 de setembro de 2021
2348,2,"adorei que o clique não é barulhento, adaptou muito bem a minha mão.",29 de março de 2021
2349,2,"Mouse muito bom precisão nos toques, sem dalay top demais recomendo.",9 de setembro de 2020
2350,2,"Amei! Chegou no dia seguinte ao que eu pedi. Veio bem embalado. Ele é leve, macio ao clicar e veio com a pilha!",27 de maio de 2021
2351,2,O mouse atendeu as minhas expectativas e funciona muito bem!,22 de dezembro de 2021
2352,2,"Estava precisando de um desses, atendeu minhas necessidades.",1 de fevereiro de 2022
2353,2,"Uso diariamente, mouse ótimo, qualidade impecável.Bom custo benefício.",31 de agosto de 2020
2354,2,Produto superou as expectativas. Melhor custo benefício!,23 de abril de 2020
2355,2,O mouse é muito bom. Eu indico esse produto!,3 de novembro de 2021
2356,2,"Mouse muito bom.E sem dúvidas o pedido mais rápido da Amazon que já recebi, 5 dias",3 de setembro de 2021
2357,2,Muito bom,30 de julho de 2020
2358,2,Excelente,19 de abril de 2021
2359,2,Excelente,15 de março de 2021
2360,2,"Bom produto, cumpre o que promete.Não gasta muita pilha",20 de novembro de 2020
2361,0,"Rolagem estragou após 13 meses, frequentemente rolando na direção contrária.",16 de agosto de 2021
2362,2,Entrega muito rápida (24 hs). Produto de excelente qualidade. Leve. Deslisa com muita facilidade.,14 de abril de 2020
2363,2,Muito bom o produto e bonito.,25 de abril de 2021
2364,2,É só conectar e começar a usar.Simples e prático.A entrega também foi bem rápida,22 de setembro de 2019
2365,2,"Até então ele está me atendendo muito bem, gostei do tamnho, não tem nenhum arranhão.",15 de setembro de 2021
2366,2,Muito bom! Atendeu as expectativas !,26 de junho de 2021
2367,2,"Otima opcao frente as outras marcas, atende tao bem quanto.",4 de junho de 2021
2368,2,Uso ele para tarefas básicas e ele tem sido ótimo pra isso.,19 de outubro de 2020
2369,2,"Recomendo o produto, tem o tamanho ideal e é muito preciso.",24 de fevereiro de 2022
2370,2,"Muito bom, preciso, ergonômico, atende bem as necessidades básicas do dia a dia",20 de maio de 2021
2371,2,"Faz uma zoadinha alta nos cliques. Mas, tudo dentro dos parametros.",15 de abril de 2021
2372,2,"Otimo Produto, chegou super rapido, bem antes do prazo super recomendo",1 de março de 2020
2373,0,O transmissor foi instalado corretamente mas o mouse simplesmente não funciona. Veio com defeito.,9 de fevereiro de 2020
2374,2,"Recomendo tanto o produto como o vendedor, ambos atenderam as expectativas.",22 de setembro de 2020
2375,2,É simples e ótimo pra tarefas de escritório e estudo. Ótimo custo benefício,28 de janeiro de 2021
2376,2,Bom mouse para uso no dia-a-dia para trabalhos q não exigem muita precisão.,13 de novembro de 2020
2377,2,Muito Bom.. Já comprei tem 1 ano e funciona perfeitamente.. Entrega rapida.,20 de janeiro de 2022
2378,1,A capinha do receptor Bluetooth saiu na minha mao quando puxei da porta USB,15 de setembro de 2020
2379,2,"bom produto, não tem que dizer muita Coisa",3 de outubro de 2019
2380,2,"Excelente mouse só um pouco menor do que imaginava, mas tirando isso ótima compra.",9 de julho de 2020
2381,2,A entrega foi muito rápida aqui pra Manaus. Estou usando e gostando,13 de novembro de 2021
2382,2,"gostei muito, já usava o com fio mas esse é 10 vezes melhor!",4 de setembro de 2020
2383,2,"prático, funciona perfeitamente, recomendo!",10 de setembro de 2020
2384,2,"O mouse é leve e bom para uso básico, mas não recomendo para jogos.",12 de novembro de 2020
2385,2,"Bonito, confortável, funciona muito bem, e a pilha é de ótima qualidade, obrigado!",21 de abril de 2021
2386,2,Ótimo custo benefício,14 de abril de 2021
2387,2,"Otimo para trabalhar, bateria dura bastante",1 de julho de 2021
2388,2,"Pode comprar sem medo, ótimo mouse.",30 de outubro de 2021
2389,0,Não funciona direito!,23 de dezembro de 2021
2390,2,Mouse excelente toque rápido !Ergonômico e presciso!,11 de dezembro de 2020
2391,2,"Conexão rapida, funciona muito bem!",15 de julho de 2021
2392,2,"Melhor mouse por custo benefício, os mais baratos são péssimos....",20 de outubro de 2020
2393,2,Gostei muito do produto! Utilizo para o meu trabalho do dia a dia.,3 de maio de 2021
2394,2,"Muito bom produto. Ergonômico, preciso, recomendo.",12 de maio de 2021
2395,2,Bom custo x benefício,28 de abril de 2021
2396,2,Mouse muito bom. Boa ergonomia e funcionalidade. Responde bem aos comandos,17 de maio de 2021
2397,2,"Produto muito bom. Ergonômico, fácil de usar e transportar quando preciso.",5 de maio de 2021
2398,2,"Muito bom,Tive um ótimo custo/benefício e a entrega foi super rápida",24 de fevereiro de 2021
2399,2,Muito bom! Ele se encaixa muito bem na mão e tem um ótimo custo beneficio.,6 de setembro de 2020
2400,2,Bom custo benefício.,19 de novembro de 2020
2401,2,Muito top vale muito a pena,16 de julho de 2021
2402,2,"Ótimo custo beneficio. Loja entregou dentro do prazo, recomendo a todos",3 de agosto de 2020
2403,2,Excelente mouse. Gostei da compra.,23 de agosto de 2020
2404,2,"Leve, rápido, adorei",20 de novembro de 2021
2405,2,Tudo perfeito,4 de novembro de 2021
2406,2,"Além ergonômico e bonito, a economia de pilha é incrível.",28 de maio de 2021
2407,2,"Produto atende as expectativas e de qualidade, recomendo!",16 de setembro de 2021
2408,2,"Útil e com bom custo-benefício, levando em conta o preço.",17 de junho de 2021
2409,2,"O mouse é perfeito para minhas atividades, foi uma ótima escolha.",15 de janeiro de 2022
2410,2,"Produto veio conforme solicitado, muito bom para trabalhar em home office.",19 de junho de 2020
2411,2,Excelente produto e entrega muito rapida.,20 de julho de 2021
2412,2,Bom custo benefício,24 de junho de 2021
2413,2,"Gostei bastante. Material leve, com uma boa precisão. Apenas uma pilha AA. E nem precisa de mouse pad.",16 de dezembro de 2019
2414,2,"Gostei, muito rápido e não trava.",5 de fevereiro de 2021
2415,2,"Comprei e chegou no dia seguinte, recomento o produto tanto quanto os serviços da Amazon, muito eficiente.",28 de janeiro de 2021
2416,2,"Pratico, leve a confortavel. Recomendo",3 de março de 2020
2417,2,"Ótimo produto, ótimo preço e ainda chegou bem antes do prazo 👏🏽👏🏽👏🏽",9 de julho de 2020
2418,2,Excelente. Preciso e ergonômico. Conexão sem problemas até o momento.,21 de dezembro de 2019
2419,2,Uso para trabalhar em casa. Muito preciso. Gostei muito.,9 de maio de 2021
2420,1,Se pudesse voltar atrás pagaria mais caro por um melhor.,5 de dezembro de 2020
2421,2,"Produto muito pratico, não perde a precisão mesmo sendo usado longe do Pc .Recomendo",31 de maio de 2020
2422,2,"Pequeno, leve, preciso, realmente tudo que necessito. Recomendo!",9 de julho de 2021
2423,2,"Produto é bom e aparentemente durável, um dos melhor que já usei",26 de setembro de 2020
2424,2,Mouse é pequeno mas não influencia na precisão de uso. Muito bom,15 de julho de 2021
2425,2,Muito macio. Um dos melhores mouses que já usei.,28 de outubro de 2020
2426,2,"Produto muito bom, vale a pena o custo benefício",25 de setembro de 2020
2427,2,Perfeito gostei de tudo nele desde a praticidade como tambem o designe .,28 de fevereiro de 2021
2428,2,Produto de qualidade comprovada,22 de maio de 2020
2429,2,Não testei para jogos. Mas é um ótimo mouse. Satisfeito!,30 de junho de 2021
2430,2,"Mouse bom, pequeno ótimo para Notebooks, custo benefício o melhor que encontrei.",19 de maio de 2020
2431,1,"Achei satisfeitorio nada de mais, mas tbm não é ruim vale a pena",10 de julho de 2021
2432,2,"Mouse para uso no dia a dia, não tem nada de mais....falta alguma luz pra saber que tá ligado!!!",26 de setembro de 2020
2433,2,"Bom acabamento, compacto.",1 de setembro de 2021
2434,2,Pelo preço não tem igual!,16 de janeiro de 2022
2435,2,"Produto muito bom, não vivo sem.",31 de julho de 2020
2436,2,Mouse muito bom! Só faltou um botão para ajuste de DPI.,23 de agosto de 2020
2437,2,"O material e acabamento são bons, o mouse é bem leve e preciso.",7 de outubro de 2020
2438,2,"Gostei do produto. Fácil de usar, veio bem embalado! Recomendo!",12 de outubro de 2020
2439,2,Ótimo até em computadores mais antigos. Super leve e funcional.,25 de julho de 2021
2440,2,O Mouse atende demais as expectativas e é ótimo a usabilidade.,18 de novembro de 2020
2441,2,"Ótimo custo e beneficio, cumpre bem sua função.",19 de janeiro de 2022
2442,2,Pesquisei muito para comprar e não me arrependo,13 de setembro de 2020
2443,2,Perfeito pra tarefas tradicionais e rotineiras.,9 de julho de 2021
2444,2,Muito bom. Supera o anterior que era da microsoft,15 de abril de 2021
2445,2,"Mouse super ergonômico,resposta precisa e o melhor custo benefício!!!!!",26 de novembro de 2020
2446,2,"Atende todas as necessidades esperadas, super ergonômico e confortável.",12 de junho de 2020
2447,2,"Gostei do mouse de uma forma geral, bem ergonômico, encaixa bem na mão.",19 de outubro de 2020
2448,0,"Mouse é bom só que frágil, o scroll (botão de rolagem) já deu problema.",18 de janeiro de 2021
2449,2,"Chegou bem antes do prazo! Funciona perfeitamente bem, gostei bastante.",30 de março de 2021
2450,2,Ergonômico.,22 de novembro de 2021
2451,2,"excelente produto , boa relação custo beneficio",26 de julho de 2021
2452,2,Produto chegou perfeito. Vendedor de confiança.,13 de agosto de 2021
2453,1,Com dois meses de uso o meu parou de funcionar.,19 de dezembro de 2021
2454,2,ótimo produto. atendeu as expectativas.,17 de maio de 2021
2455,2,"Uso para o cotidiano, simples e direto.",26 de agosto de 2020
2456,2,"produto muito confiavel, otimo ao toque responde muito bem aos comandos",8 de setembro de 2021
2457,2,"Produto perfeito, design fantástico, super confortável para o trabalho!",22 de novembro de 2021
2458,2,"Muito bom o produto, recomendo. Muito melhor do que eu esperava.",14 de novembro de 2020
2459,2,"Excelente mouse. Possuía um outro modelo da Logitech, o M185. Confortável e nesse dual color ficou muito bonito.",22 de novembro de 2019
2460,2,"A mídia não pôde ser carregada.
                




   bonito e atendeu o custo beneficio",11 de outubro de 2021
2461,2,Gostei: ergonomia,9 de setembro de 2021
2462,2,"Achei apenas um pouco pequeno, mas funciona muito bem.",14 de setembro de 2020
2463,2,Recomendo.,10 de setembro de 2021
2464,2,Dispositivo de fácil instalação e muito bom para usar.,24 de julho de 2021
2465,0,O produto chegou sem o plug usb para conexão Bluetooth,25 de março de 2021
2466,2,"Preciso, confiável, ergonômico. muito bom.. Recomendo.",14 de março de 2021
2467,2,"Muito bom o mouse! Preciso, barato, rápido e conforme descrito",13 de agosto de 2021
2468,2,"Produto muito bom, bateria dura muito tempo. Recomendo demais.",3 de outubro de 2021
2469,1,"Não recomendo, a troca de pilha é constante e começa a falhar.",26 de agosto de 2020
2470,2,Produto de qualidade e preciso. Vale a compra.,28 de janeiro de 2021
2471,2,Produto de qualidade e de bom custo benefício!,29 de abril de 2021
2472,2,"Só achei um pouquinho menor que o esperado, mas é um produto muito bom",30 de abril de 2021
2473,2,Tem um ótimo custo-benefício. É bom e supri as necessidades. Recomendo,4 de maio de 2021
2474,2,Eu uso para edição de vídeos e ele responde muito rápido aos comandos.,1 de dezembro de 2020
2475,2,"Acabamento impecável, bem robusto e resistênte. Ótimo custo benefício!",27 de julho de 2021
2476,2,"Gostei muito, produto original.",10 de dezembro de 2021
2477,2,Gostei muito.Comprei num domingo e chegou na terça de manhã,26 de abril de 2020
2478,2,Mouse atende todas as necessidades do dia a dia e com ótimo custo benefício.,21 de julho de 2020
2479,2,Até o momento não tenho o que reclamar,22 de janeiro de 2021
2480,2,"Super confortável , precisão muito boa",30 de janeiro de 2021
2481,2,Produto de ótima qualidade e precisão.,23 de outubro de 2021
2482,2,Bom,4 de maio de 2021
2483,2,Excelente produto.,14 de novembro de 2020
2484,2,Mouse muito bonito e ótimo custo benefício. Para utilização simples cumpre o que promete.,24 de abril de 2020
2485,2,Que mouse top!!!,8 de maio de 2021
2486,2,Fácil instalação,20 de outubro de 2020
2487,2,Muito bom e prático,15 de junho de 2020
2488,2,Leve e barato. Cusro Benefício,18 de abril de 2021
2489,2,"leve, bonito, gostei bastante.",21 de junho de 2021
2490,2,utilização automática. sem necessidade de instalação.,5 de setembro de 2020
2491,2,muito bom o produto e a entrega foi em tempo recorde.,19 de setembro de 2020
2492,2,foi a melhor relação custo beneficio que eu encontrei,16 de junho de 2021
2493,2,Bom mas a precisão do clique as vezes deixa a desejar,14 de agosto de 2021
2494,2,"Mouse compacto, bom e preciso, ótimo custo benefício.",3 de março de 2022
2495,2,"BOM, BONITO E BARATO.vou comprar outro em breve",20 de dezembro de 2020
2496,2,Muito bom,11 de abril de 2021
2497,2,Excelente,27 de junho de 2020
2498,2,A entrega foi feita jogando o produto frágil por cima do muro,15 de janeiro de 2022
2499,2,Produto atende a expectativa para uso diário para o trabalho.,9 de fevereiro de 2022
2500,2,Bom custo benefício pra quem usa no cotidiano. Ótimo produto.,29 de julho de 2020
2501,2,"Atendeu perfeitamente minhas necessidades, muito bom produto.",9 de fevereiro de 2021
2502,2,Muito bom o custo beneficio só não dá para saber se é duravel,4 de junho de 2021
2503,2,"O produto é bom, comprei há 2 anos atrás e ainda funciona bem",4 de outubro de 2021
2504,2,Mouse muito bom! A pilha dura super... Recomendo com certeza.,28 de junho de 2021
2505,2,Bem funcional e elegante. Bom custo-benefício,20 de outubro de 2020
2506,2,Leve e confortável. Me impressionou bastante!,27 de maio de 2021
2507,0,"Veio faltando uma peça, não consigo instalar.",14 de outubro de 2021
2508,2,"produto bom, atendeu bem minhas expectativas.",27 de fevereiro de 2022
2509,2,Excelente custo-benefício. Produto muito bom.,29 de março de 2021
2510,2,"ótimo produto, muito confortável, atende bem.",2 de junho de 2021
2511,0,avaliação péssima pois o produto não funciona e não consigo devolver.,23 de abril de 2021
2512,2,"Muito bom. Tamanho excelente, resposta boa do mouse, bonito e simples",19 de maio de 2021
2513,2,"Ja vem com a pilha, e ótima precisão. Parece ter uma boa durabilidade",20 de agosto de 2020
2514,2,"Veio em perfeito estado, funcionando tudo. Entrega antes do previsto.",18 de abril de 2021
2515,2,Eu uso para estudar e ele está sendo ótimo!,2 de agosto de 2020
2516,2,Entrega muito rápida e um mouse com ótimo custo benefício. É OS GURI!,18 de janeiro de 2021
2517,2,Qualidade e rapidez. Produto perfeito,22 de janeiro de 2022
2518,2,Excelente. Preciso e molda bem na mão,14 de abril de 2021
2519,2,"Gostei do mouse. Tem uma ótima precisão, é leve e bonito. Tudo certo.",24 de fevereiro de 2022
2520,2,Ótimo custo benefício!,4 de maio de 2021
2521,2,O melhor mouse sem fio,24 de setembro de 2021
2522,2,Excelente mouse,18 de fevereiro de 2021
2523,2,Leve e preciso. Gostei muito.,26 de maio de 2021
2524,2,"O mouse tem um ótimo preço. Às vezes sofre interferência, mas nada que comprometa.",21 de agosto de 2020
2525,2,"Ótima duração de bateria, bem preciso e confortável.",7 de outubro de 2020
2526,2,"ergonômico e funcional, além do design ser simpatico",30 de março de 2021
2527,2,"Atendeu minha espectativa. Quanto a jogar, não usei.",16 de abril de 2021
2528,2,Perfeito,31 de agosto de 2020
2529,2,"Excelenteproduto, tamanho que encaixa bem à mão, ergonômico.",16 de julho de 2021
2530,2,Acessório com muito bom custo/benefício. Atende bem as necessidades.,1 de setembro de 2020
2531,0,"O produto veio com defeito, mesmo após trocar a pilha não funcionou.",15 de maio de 2021
2532,2,"A ergonomia não é a das melhores, mas o custo benefício é excelente.",9 de setembro de 2021
2533,2,"Excelente, esse mouse logitech é bom demais e extremamente econômico",4 de novembro de 2020
2534,2,"Ótimo produto. Trabalho com autocad e sketchup, me atende super bem.",11 de janeiro de 2021
2535,2,"mouse com precisão, atendendo as expectativas e entrega super rápida",8 de fevereiro de 2021
2536,2,"Ótima qualidade, leve, macio.",30 de outubro de 2020
2537,2,Ótimo mouse para o dia a dia!,28 de novembro de 2021
2538,2,O mouse tem um excelente custo benefício e foi entregue rapidamente.,15 de setembro de 2021
2539,2,"No geral é um bom mouse, bastante preciso. Mas eu particularmente achei ele bem menor do que aparentava ser pelas fotos.",14 de julho de 2020
2540,2,"Excelente mouse, um dos melhores do mercado.",13 de dezembro de 2021
2541,2,Comprei para minha filha e ela gostou muito.,14 de dezembro de 2021
2542,2,Mouse super leve,4 de março de 2020
2543,2,Mouse com excelente custo-benefício.,3 de março de 2022
2544,2,Produto atendeu minhas necessidades!,5 de outubro de 2020
2545,2,"Utilizo no trabalho, e esta marca é um das poucas que aceita no MAC.",4 de agosto de 2021
2546,2,Ótima qualidade e funciona perfeitamente. Chegou super rápido também.,20 de novembro de 2020
2547,2,Produto de qualidade!,30 de maio de 2021
2548,2,já conhecia o produto,21 de janeiro de 2022
